{
  "$schema": "https://json-schema.org/draft/2020-12/schema",
  "$id": "https://raw.githubusercontent.com/j-d-ha/format/main/format.schema.json",
  "title": "format configuration",
  "description": "Configuration file for the format CLI.",
  "type": "object",
  "additionalProperties": false,
  "required": ["version", "formatters"],
  "properties": {
    "version": {
      "type": "integer",
      "description": "Configuration schema version.",
      "minimum": 1
    },
    "matchPolicy": {
      "type": "string",
      "description": "Controls how formatter matches are applied.",
      "enum": ["all", "first"],
      "default": "all"
    },
    "exclude": {
      "$ref": "#/$defs/globPatterns",
      "description": "Global glob patterns that are ignored before formatter-specific matching."
    },
    "workingDirectory": {
      "$ref": "#/$defs/workingDirectory",
      "description": "Default process working directory for formatter commands. Relative paths are resolved from the caller's current working directory."
    },
    "formatters": {
      "type": "array",
      "description": "Ordered formatter definitions.",
      "minItems": 1,
      "items": {
        "$ref": "#/$defs/formatter"
      }
    }
  },
  "$defs": {
    "globPatterns": {
      "type": "array",
      "items": {
        "type": "string",
        "minLength": 1
      },
      "default": []
    },
    "formatter": {
      "type": "object",
      "additionalProperties": false,
      "required": ["name", "patterns", "command"],
      "properties": {
        "name": {
          "type": "string",
          "description": "Human-readable formatter identifier.",
          "minLength": 1
        },
        "patterns": {
          "$ref": "#/$defs/nonEmptyGlobPatterns",
          "description": "Glob patterns matched against candidate file paths."
        },
        "exclude": {
          "$ref": "#/$defs/globPatterns",
          "description": "Formatter-specific glob patterns to ignore."
        },
        "workingDirectory": {
          "$ref": "#/$defs/workingDirectory",
          "description": "Formatter-specific process working directory. Overrides the top-level workingDirectory."
        },
        "filesDelimiter": {
          "type": "string",
          "description": "Delimiter used to join file paths when expanding $FILES. Defaults to a single space.",
          "default": " "
        },
        "command": {
          "type": "array",
          "description": "Executable and arguments used to invoke the formatter. Include $FILES where the assigned files should be expanded. Use $WORKING_DIRECTORY to pass the resolved process working directory.",
          "minItems": 1,
          "items": {
            "type": "string",
            "minLength": 1
          },
          "contains": {
            "pattern": "\\$FILES"
          }
        }
      }
    },
    "workingDirectory": {
      "type": "string",
      "minLength": 1
    },
    "nonEmptyGlobPatterns": {
      "allOf": [
        {
          "$ref": "#/$defs/globPatterns"
        },
        {
          "minItems": 1
        }
      ]
    }
  }
}
